{
  "$schema": "https://json-schema.org/draft/2020-12/schema",
  "$id": "https://impresso.github.io/impresso-schemas/json/impresso-2/solr-indexing/semantic-enrichments/sem.root.topics.v3.schema.json",
  "title": "Topic Solr Document",
  "description": "Schema for topic description documents in Solr (Impresso Project)",
  "type": "object",
  "properties": {
    "id": {
      "type": "string",
      "description": "Unique identifier for the topic (format: model_id_tp{number}_{lang})",
      "pattern": "^tm-[a-z]{2}-[a-z]+-v[0-9]+\\.[0-9]+_tp[0-9]+_[a-z]{2}$"
    },
    "lg_s": {
      "type": "string",
      "description": "Language code (ISO lowercase)",
      "minLength": 2,
      "maxLength": 2
    },
    "tp_model_s": {
      "type": "string",
      "description": "Topic model identifier",
      "pattern": "^tm-[a-z]{2}-[a-z]+-v[0-9]+\\.[0-9]+$"
    },
    "tp_nb_i": {
      "type": "integer",
      "description": "Topic number (integer field)",
      "minimum": 0
    },
    "word_probs_dpf": {
      "type": "string",
      "description": "Word probabilities in DPFS format (space-separated pairs of 'word|probability')",
      "minLength": 1
    },
    "topic_suggest": {
      "type": "string",
      "description": "Space-separated list of topic words for suggestion/autocomplete",
      "minLength": 1
    },
    "tp_desc_s": {
      "type": "string",
      "description": "Optional topic description"
    },
    "tp_meta_s": {
      "type": "string",
      "description": "Optional topic metadata"
    },
    "topic_type_s": {
      "type": "string",
      "description": "Topic category assigned by the label-generation model (e.g. 'advertisement', 'legal_administrative') — topic labels v3. Optional: absent on pre-v3 topic-description-only documents."
    },
    "label_short_s": {
      "type": "string",
      "description": "Short human-readable topic label — topic labels v3. Optional: absent on pre-v3 topic-description-only documents."
    },
    "label_long_txt_en": {
      "type": "string",
      "description": "Long-form English topic label/description, analyzed text — topic labels v3. Optional: absent on pre-v3 topic-description-only documents."
    },
    "confidence_s": {
      "type": "string",
      "enum": ["high", "medium", "low"],
      "description": "Confidence level of the generated label — topic labels v3. Optional: absent on pre-v3 topic-description-only documents."
    },
    "representative_terms_ss": {
      "type": "array",
      "items": { "type": "string" },
      "description": "Representative terms backing the generated topic label — topic labels v3. Optional: absent on pre-v3 topic-description-only documents."
    },
    "generated_by_s": {
      "type": "string",
      "description": "Attribution for the topic-label generation process (e.g. 'OpenAI') — topic labels v3. Optional: absent on pre-v3 topic-description-only documents."
    }
  },
  "required": [
    "id",
    "lg_s",
    "word_probs_dpf",
    "tp_model_s",
    "tp_nb_i",
    "topic_suggest"
  ],
  "additionalProperties": true
}

