{
      "id":"tm-fr-all-v2.0_tp00_fr",
      "lg_s":"fr",
      "tp_model_s":"tm-fr-all-v2.0",
      "tp_nb_i":0,
      "word_probs_dpf":"pays|0.01966 foi|0.01544 cours|0.01464 part|0.01368 dune|0.01336 temps|0.01284 vie|0.01236 travail|0.01065 monde|0.01055 membre|0.00952 fait|0.0095 effet|0.00943 point|0.00941 plan|0.00897 nombre|0.00831 partie|0.00782 vue|0.00778 fin|0.00743 cas|0.00729 chef|0.00699 compte|0.00685 question|0.00664 lieu|0.00651 sen|0.00647 effort|0.00636 comite|0.00636 place|0.00616 marche|0.00609 raison|0.00599 sil|0.00596 presse|0.00583 directeur|0.00538 conseil|0.00534 rapport|0.00515 suisse|0.00496 domaine|0.00475 mesure|0.00475 exemple|0.00459 service|0.00458 moment|0.00457 sujet|0.0045 ville|0.00443 nom|0.00438 canton|0.00438 cause|0.00419 faveur|0.00418 valeur|0.00402 suite|0.00397 groupe|0.00396 droit|0.00387 besoin|0.00386 occasion|0.00379 doute|0.00378 population|0.00367 aide|0.00362 mois|0.00361 forme|0.0036 action|0.00358 peuple|0.00356 appel|0.00355 gens|0.00353 esprit|0.00348 but|0.00347 collaboration|0.00332 propos|0.00332 voie|0.0033 chose|0.00321 tour|0.00315 face|0.00313 titre|0.00313 formation|0.00312 main|0.00307 cadre|0.00307 mouvement|0.00305 commission|0.00303 mise|0.00302 soi|0.00294 politique|0.0029 base|0.00289 confiance|0.00286 professeur|0.00286 mission|0.00284 force|0.00283 ordre|0.00282 direction|0.00276 lutte|0.00276 prise|0.00269 jeunesse|0.00267 souci|0.00266 avenir|0.00266 conseiller|0.00263 sorte|0.0026 campagne|0.00259 conscience|0.00253 famille|0.00247 guerre|0.00246 ensemble|0.00245 preuve|0.00239 rencontre|0.00234 nature|0.00226 plupart|0.00224 sein|0.00219 joseph|0.00216 public|0.00211 recherche|0.00211 connaissance|0.00206 attention|0.00204 choix|0.00201 personne|0.00197 oeuvre|0.00196 peine|0.00195 semaine|0.00193 moyen|0.00193 con|0.00193 gouvernement|0.00192 message|0.0019 joie|0.00189 visite|0.00187 corps|0.00184 reste|0.00183 condition|0.00182 contact|0.00182 manifestation|0.00181 principe|0.0018 genre|0.0018 mot|0.00179 position|0.00175 disposition|0.00174 congre|0.00174 somme|0.00171 attitude|0.0017 pied|0.0017 satisfaction|0.00169 paix|0.00167 terre|0.00166 signe|0.00166 niveau|0.00166 maison|0.00165 terme|0.00165 traite|0.00164 contraire|0.00163 existence|0.00162 pratique|0.0016 affaire|0.00157 parti|0.00155 mai|0.00155 garde|0.00155 travers|0.00154 parole|0.00153 objet|0.00153",
      "topic_suggest":"pays foi cours part dune temps vie travail monde membre fait effet point plan nombre partie vue fin cas chef compte question lieu sen effort comite place marche raison sil presse directeur conseil rapport suisse domaine mesure exemple service moment sujet ville nom canton cause faveur valeur suite groupe droit besoin occasion doute population aide mois forme action peuple appel gens esprit but collaboration propos voie chose tour face titre formation main cadre mouvement commission mise soi politique base confiance professeur mission force ordre direction lutte prise jeunesse souci avenir conseiller sorte campagne conscience famille guerre ensemble preuve rencontre nature plupart sein joseph public recherche connaissance attention choix personne oeuvre peine semaine moyen con gouvernement message joie visite corps reste condition contact manifestation principe genre mot position disposition congre somme attitude pied satisfaction paix terre signe niveau maison terme traite contraire existence pratique affaire parti mai garde travers parole objet"
}